<?xml version = "1.0"?>
<xsd:schema xmlns:xsd="http://www.w3.org/2001/XMLSchema">

    <xsd:element name="rootElement" type="resourceType" />

    <xsd:complexType name="resourceType">
        <annotation xmlns="http://www.w3.org/2001/XMLSchema">
            <documentation>
                A resource root within a deployment.
            </documentation>
        </annotation>
        <xsd:all>
            <xsd:element name="filter" type="filterType"
                minOccurs="0">
                <annotation xmlns="http://www.w3.org/2001/XMLSchema">
                    <documentation>
                        A path filter specification for this
                        resource root (optional). By default all paths
                        are accepted.
                    </documentation>
                </annotation>
            </xsd:element>
        </xsd:all>
        <xsd:attribute name="name" type="xsd:string" use="optional">
            <annotation xmlns="http://www.w3.org/2001/XMLSchema">
                <documentation>
                    The name of this resource root
                    (optional). If not specified, defaults to the value
                    of the path
                    attribute.
                </documentation>
            </annotation>
        </xsd:attribute>
        <xsd:attribute name="path" type="xsd:string" use="required">
            <annotation xmlns="http://www.w3.org/2001/XMLSchema">
                <documentation>
                    The path of this resource root, relative
                    to the path in which the module.xml file is found.
                </documentation>
            </annotation>
        </xsd:attribute>
    </xsd:complexType>

    <xsd:complexType name="filterType">
        <annotation xmlns="http://www.w3.org/2001/XMLSchema">
            <documentation>
                A filter specification, consisting of zero or
                more filter items.
            </documentation>
        </annotation>
        <xsd:choice minOccurs="0" maxOccurs="unbounded">
            <xsd:element name="include" type="pathSpecType"
                minOccurs="0">
                <annotation xmlns="http://www.w3.org/2001/XMLSchema">
                    <documentation>
                        A path to include. The path value can
                        be a path name or a "glob" which may include the
                        special
                        wildcards "*", "**", and "?".
                    </documentation>
                </annotation>
            </xsd:element>
            <xsd:element name="exclude" type="pathSpecType"
                minOccurs="0">
                <annotation xmlns="http://www.w3.org/2001/XMLSchema">
                    <documentation>
                        A path to exclude. The path value can
                        be a path name or a "glob" which may include the
                        special
                        wildcards "*", "**", and "?".
                    </documentation>
                </annotation>
            </xsd:element>
            <xsd:element name="include-set" type="pathSetType"
                minOccurs="0">
                <annotation xmlns="http://www.w3.org/2001/XMLSchema">
                    <documentation>
                        A set of literal path names to
                        include. Wildcards are not supported.
                    </documentation>
                </annotation>
            </xsd:element>
            <xsd:element name="exclude-set" type="pathSetType"
                minOccurs="0">
                <annotation xmlns="http://www.w3.org/2001/XMLSchema">
                    <documentation>
                        A set of literal path names to
                        exclude. Wildcards are not supported.
                    </documentation>
                </annotation>
            </xsd:element>
        </xsd:choice>
    </xsd:complexType>

    <xsd:complexType name="pathSpecType">
        <annotation xmlns="http://www.w3.org/2001/XMLSchema">
            <documentation>
                A path specification type, which may include
                wildcards.
            </documentation>
        </annotation>
        <xsd:attribute name="path" type="xsd:string" use="required">
            <annotation xmlns="http://www.w3.org/2001/XMLSchema">
                <documentation>
                    The path name, which can be a literal
                    path name or it may include the special wildcards
                    "*", "**",
                    and "?".
                </documentation>
            </annotation>
        </xsd:attribute>
    </xsd:complexType>

    <xsd:complexType name="pathSetType">
        <annotation xmlns="http://www.w3.org/2001/XMLSchema">
            <documentation>
                A set of literal path names which can be used
                for efficient matching against multiple possible values.
            </documentation>
        </annotation>
        <xsd:choice minOccurs="0" maxOccurs="unbounded">
            <xsd:element name="path" type="pathType"
                minOccurs="0">
                <annotation xmlns="http://www.w3.org/2001/XMLSchema">
                    <documentation>
                        The path name to include in the set.
                    </documentation>
                </annotation>
            </xsd:element>
        </xsd:choice>
    </xsd:complexType>

    <xsd:complexType name="pathType">
        <annotation xmlns="http://www.w3.org/2001/XMLSchema">
            <documentation>
                A filesystem path name.
            </documentation>
        </annotation>
        <xsd:attribute name="name" type="xsd:string" use="required">
            <annotation xmlns="http://www.w3.org/2001/XMLSchema">
                <documentation>
                    The path name.
                </documentation>
            </annotation>
        </xsd:attribute>
    </xsd:complexType>

</xsd:schema>